{
  "as_of": "2026-08-31",
  "claim_boundary": "Stable IDs cover the candidate operations and Agent Runtime profiles. Legacy normative statements are enumerated as open gaps and no empty evidence list is a pass.",
  "coverage": {
    "identified_requirement_count": 97,
    "legacy_normative_statements_without_stable_id": [
      {
        "keywords": [
          "MUST"
        ],
        "line": 121,
        "line_sha256": "bab60217c6c4465719aba8eb23171b9b9f25f287c72c7f0cb0a3a67c332de18f",
        "path": "specs/VCP_SPECIFICATION_v3.1.md"
      },
      {
        "keywords": [
          "MUST"
        ],
        "line": 124,
        "line_sha256": "e0810bed3062b0bc510ca46b6b78a4919309571fba9b8e20b6dc98d6a6d14f85",
        "path": "specs/VCP_SPECIFICATION_v3.1.md"
      },
      {
        "keywords": [
          "MUST"
        ],
        "line": 127,
        "line_sha256": "04b31f027d7d1437a41ca79e93259db5cdb019645bd15d11019cdf535c2b0b17",
        "path": "specs/VCP_SPECIFICATION_v3.1.md"
      },
      {
        "keywords": [
          "MUST"
        ],
        "line": 130,
        "line_sha256": "9d493c45fd3b372b6a150e95a7e57b6f64374db4d8169ec260b5fc58840466c7",
        "path": "specs/VCP_SPECIFICATION_v3.1.md"
      },
      {
        "keywords": [
          "MUST"
        ],
        "line": 139,
        "line_sha256": "14855c419e29babf06cd0a468cd45fd680eca3731b9f2d9bfe10681259907abd",
        "path": "specs/VCP_SPECIFICATION_v3.1.md"
      },
      {
        "keywords": [
          "MUST NOT"
        ],
        "line": 155,
        "line_sha256": "425497b90acf99d16a77fc290d23dd9c72209a9683e7387957517e9d54e9e0ca",
        "path": "specs/VCP_SPECIFICATION_v3.1.md"
      },
      {
        "keywords": [
          "MAY"
        ],
        "line": 241,
        "line_sha256": "9047123fa1ec76106a59f588dbb762f8fb854759d9b35b86a531c11411316c29",
        "path": "specs/VCP_SPECIFICATION_v3.1.md"
      },
      {
        "keywords": [
          "MUST NOT"
        ],
        "line": 27,
        "line_sha256": "237c979baa5d73536818351bedeae58b4b639f6489fa5183c55ea8f58b7ed26e",
        "path": "specs/core/audit.md"
      },
      {
        "keywords": [
          "MUST"
        ],
        "line": 32,
        "line_sha256": "fc5a046d730c2fbf79e263a8b4b8035a79c5b6697a33b27c6cbb70021e11e7d3",
        "path": "specs/core/audit.md"
      },
      {
        "keywords": [
          "MUST NOT"
        ],
        "line": 61,
        "line_sha256": "c5861f09065ce1fd9907bf14cef17e3bd09f9f2e958dcae087c8cee51ba4f6a0",
        "path": "specs/core/audit.md"
      },
      {
        "keywords": [
          "MAY"
        ],
        "line": 237,
        "line_sha256": "3572ae89a42c5e622510bc2833bf2f561cc6cb3c3c4cec6be8a615ccd0cccb19",
        "path": "specs/core/audit.md"
      },
      {
        "keywords": [
          "MUST"
        ],
        "line": 239,
        "line_sha256": "fcd9fa228bacc8f1907a5c6250d8c8bd7e7d98bf7d4db2ecfab537b5587cb9c9",
        "path": "specs/core/audit.md"
      },
      {
        "keywords": [
          "MUST NOT"
        ],
        "line": 241,
        "line_sha256": "d2f906602b0805712911161bbd403c054cdcc3492381dac2c53e63ac57aea608",
        "path": "specs/core/audit.md"
      },
      {
        "keywords": [
          "SHOULD"
        ],
        "line": 325,
        "line_sha256": "795a9014519d1d2a4910f8b941cd5e7f60870559653b31a8979a0dd11d445002",
        "path": "specs/core/audit.md"
      },
      {
        "keywords": [
          "MUST"
        ],
        "line": 328,
        "line_sha256": "5f4b6d05dcc0b02ea130ab53b02c61b460d57b96d78e0d9a0e5a0d2100341480",
        "path": "specs/core/audit.md"
      },
      {
        "keywords": [
          "MUST NOT"
        ],
        "line": 335,
        "line_sha256": "6602501015a25011ea59678b486b24d4bbe9deee62ca6eb173792872711a9a97",
        "path": "specs/core/audit.md"
      },
      {
        "keywords": [
          "SHOULD"
        ],
        "line": 338,
        "line_sha256": "87a3fd262bddf935fc61ac7b02b0bee685f1f62abd97c84c484af20519c6a6e3",
        "path": "specs/core/audit.md"
      },
      {
        "keywords": [
          "MAY"
        ],
        "line": 349,
        "line_sha256": "343b8ac472ad095e54f99cf52c6d2d1993dc33a3796ff24957e64e8d9a9f7890",
        "path": "specs/core/audit.md"
      },
      {
        "keywords": [
          "MUST",
          "MUST NOT",
          "REQUIRED",
          "SHALL",
          "SHALL NOT",
          "SHOULD"
        ],
        "line": 18,
        "line_sha256": "d5372fbbde757468cfac95d934b1fb9720ec4e8265d1adb8e478c629f48c7464",
        "path": "specs/core/capability-negotiation.md"
      },
      {
        "keywords": [
          "MAY",
          "RECOMMENDED",
          "SHOULD NOT"
        ],
        "line": 19,
        "line_sha256": "8b433eac7c8beb0e19f730cabbf202524333ac88aa8babeca836486e3d8b9300",
        "path": "specs/core/capability-negotiation.md"
      },
      {
        "keywords": [
          "MUST"
        ],
        "line": 25,
        "line_sha256": "c84a782c6b090a4a98ca27067dfe9ae63ba3eb3d5b4dd58c5bae92fb46139114",
        "path": "specs/core/capability-negotiation.md"
      },
      {
        "keywords": [
          "MUST"
        ],
        "line": 27,
        "line_sha256": "0ada008f036d356fbb3ccfd372d6b2d73ce7f2717e1c5191be1b892ccca03238",
        "path": "specs/core/capability-negotiation.md"
      },
      {
        "keywords": [
          "MUST",
          "REQUIRED"
        ],
        "line": 100,
        "line_sha256": "2439a9fca66d2937972e47d7be80830b217a6f824314bb4c7c6489ad173d30cd",
        "path": "specs/core/capability-negotiation.md"
      },
      {
        "keywords": [
          "REQUIRED"
        ],
        "line": 101,
        "line_sha256": "c22d5872f39357478c71eff5d76d5101a48bd10638ed03fff980fd0cf1e5fa1e",
        "path": "specs/core/capability-negotiation.md"
      },
      {
        "keywords": [
          "MUST"
        ],
        "line": 102,
        "line_sha256": "c868faaefe8f0dd16558e59c64bc2149f2b9ac5f998b197c5ffe6c8759f02d7a",
        "path": "specs/core/capability-negotiation.md"
      },
      {
        "keywords": [
          "MUST NOT"
        ],
        "line": 105,
        "line_sha256": "fbff6d4529461cd6728686fd64ce8c5cfe3e65c50fb0db31c9017edb4a4194a3",
        "path": "specs/core/capability-negotiation.md"
      },
      {
        "keywords": [
          "MUST"
        ],
        "line": 109,
        "line_sha256": "df2a49445a147612b021b347ceb0613d938cd09db16a0b45237fbcba107165be",
        "path": "specs/core/capability-negotiation.md"
      },
      {
        "keywords": [
          "MUST"
        ],
        "line": 111,
        "line_sha256": "0a3a09abec76676cad9bbf7fc282038cc0e0e76766787f59cee5f8509bb14cb8",
        "path": "specs/core/capability-negotiation.md"
      },
      {
        "keywords": [
          "MUST"
        ],
        "line": 112,
        "line_sha256": "165ae653a416d6460a588fd8e9b2b09f9f0607132a016ace097739d93db24beb",
        "path": "specs/core/capability-negotiation.md"
      },
      {
        "keywords": [
          "SHOULD"
        ],
        "line": 113,
        "line_sha256": "e3d9894ba9e6abce5e92605e8e606a9e42126ab20519a00a03e54c8ae9e41986",
        "path": "specs/core/capability-negotiation.md"
      },
      {
        "keywords": [
          "MUST"
        ],
        "line": 114,
        "line_sha256": "fb4e635c8f74bb7bd2b29c22ecc0671471ae2671562e3706bb90d3f775082a50",
        "path": "specs/core/capability-negotiation.md"
      },
      {
        "keywords": [
          "MUST",
          "REQUIRED"
        ],
        "line": 159,
        "line_sha256": "4bebac9137ba618f33721a93b0d19bd95f1238f9ea679b8666ddcf9599d78636",
        "path": "specs/core/capability-negotiation.md"
      },
      {
        "keywords": [
          "MUST",
          "REQUIRED"
        ],
        "line": 160,
        "line_sha256": "61cdf3b6664b398f7d7cecca9111a7267366c8157ad3f838071fc242c16a29d6",
        "path": "specs/core/capability-negotiation.md"
      },
      {
        "keywords": [
          "REQUIRED"
        ],
        "line": 161,
        "line_sha256": "d9bd1bfc5e1862e41a3d9e8ed48cb736fbbb4014d265ca8fb224c30dc9672fe8",
        "path": "specs/core/capability-negotiation.md"
      },
      {
        "keywords": [
          "REQUIRED"
        ],
        "line": 162,
        "line_sha256": "681f53cae14d9a4990bec42025205a577ffa6df87036b55dff1efbbf0595e2df",
        "path": "specs/core/capability-negotiation.md"
      },
      {
        "keywords": [
          "REQUIRED"
        ],
        "line": 163,
        "line_sha256": "ce11f319c809a43affd19572fc46f5ea3b34f4615dd1482d7dbc39efbef99388",
        "path": "specs/core/capability-negotiation.md"
      },
      {
        "keywords": [
          "REQUIRED"
        ],
        "line": 164,
        "line_sha256": "436359cf1b514f567b1ffb12ca615c7d5c09856208fe8287bde34db98fb47ece",
        "path": "specs/core/capability-negotiation.md"
      },
      {
        "keywords": [
          "MUST"
        ],
        "line": 170,
        "line_sha256": "f49634e029675c45d290ea75619f88c55ffce642c8c5145323b7e3845209b977",
        "path": "specs/core/capability-negotiation.md"
      },
      {
        "keywords": [
          "MUST"
        ],
        "line": 172,
        "line_sha256": "d18c9f58e240cc3eedb01e1bcbacba5f64173cf75c5f7e51ecd95427a2a53206",
        "path": "specs/core/capability-negotiation.md"
      },
      {
        "keywords": [
          "MUST"
        ],
        "line": 173,
        "line_sha256": "724c6e5c743c0efbcd2ec48919f26f6ed523aa17bb9f433c30e4f5cde384006f",
        "path": "specs/core/capability-negotiation.md"
      },
      {
        "keywords": [
          "MUST NOT"
        ],
        "line": 174,
        "line_sha256": "3b8f02aee0aabeadbe1778ae90c7adf4bba432ef70967b9361b40b4d6a843e92",
        "path": "specs/core/capability-negotiation.md"
      },
      {
        "keywords": [